{
    "id":  "relationship.relic-reward-lith-g1-radiant-2x-forma-blueprint",
    "type":  "relic_reward",
    "from":  "relic.lith-g1-radiant",
    "to":  "part.2x-forma-blueprint",
    "summary":  "relic.lith-g1-radiant contains 2X Forma Blueprint as a reward.",
    "conditions":  {
                       "rarity":  "Uncommon"
                   },
    "values":  {
                   "chance":  20,
                   "rewardName":  "2X Forma Blueprint"
               },
    "tags":  [
                 "relic",
                 "reward",
                 "wfcd-generated"
             ],
    "sources":  [
                    {
                        "type":  "wfcd-generated",
                        "value":  "relic:relic.lith-g1-radiant"
                    }
                ]
}
