{
    "id":  "relationship.drop-acceltra-prime-receiver-neo-o2-relic-radiant",
    "type":  "wfcd_drop",
    "from":  "source.neo-o2-relic-radiant",
    "to":  "part.acceltra-prime-receiver",
    "summary":  "Neo O2 Relic (Radiant) can drop Acceltra Prime Receiver.",
    "conditions":  {

                   },
    "values":  {
                   "location":  "Neo O2 Relic (Radiant)",
                   "chance":  20,
                   "rarity":  "Uncommon",
                   "rewardType":  "Acceltra Prime Receiver",
                   "parentId":  "weapon.acceltra-prime"
               },
    "tags":  [
                 "drop",
                 "wfcd-generated"
             ],
    "sources":  [
                    {
                        "type":  "wfcd-generated",
                        "value":  "drop:weapon.acceltra-prime"
                    }
                ]
}
