{
    "id":  "relationship.drop-akmagnus-prime-magnus-prime-axi-s14-relic-exceptional",
    "type":  "wfcd_drop",
    "from":  "source.axi-s14-relic-exceptional",
    "to":  "part.akmagnus-prime-magnus-prime",
    "summary":  "Axi S14 Relic (Exceptional) can drop Magnus Prime Blueprint.",
    "conditions":  {

                   },
    "values":  {
                   "location":  "Axi S14 Relic (Exceptional)",
                   "chance":  23.33,
                   "rarity":  "Uncommon",
                   "rewardType":  "Magnus Prime Blueprint",
                   "parentId":  "weapon.akmagnus-prime"
               },
    "tags":  [
                 "drop",
                 "wfcd-generated"
             ],
    "sources":  [
                    {
                        "type":  "wfcd-generated",
                        "value":  "drop:weapon.akmagnus-prime"
                    }
                ]
}
