{
    "id":  "relationship.drop-saryn-prime-systems-axi-g1-relic-flawless",
    "type":  "wfcd_drop",
    "from":  "source.axi-g1-relic-flawless",
    "to":  "part.saryn-prime-systems",
    "summary":  "Axi G1 Relic (Flawless) can drop Saryn Prime Systems Blueprint.",
    "conditions":  {

                   },
    "values":  {
                   "location":  "Axi G1 Relic (Flawless)",
                   "chance":  20,
                   "rarity":  "Uncommon",
                   "rewardType":  "Saryn Prime Systems Blueprint",
                   "parentId":  "warframe.saryn-prime"
               },
    "tags":  [
                 "drop",
                 "wfcd-generated"
             ],
    "sources":  [
                    {
                        "type":  "wfcd-generated",
                        "value":  "drop:warframe.saryn-prime"
                    }
                ]
}
