{
    "id":  "relationship.drop-galariak-prime-blueprint-dark-refractory-deimos-recall-hunhullus-the-perita-rebellion-rotation-a",
    "type":  "wfcd_drop",
    "from":  "activity.dark-refractory-deimos-recall-hunhullus",
    "to":  "part.galariak-prime-blueprint",
    "summary":  "Dark Refractory, Deimos/Recall: Hunhullus (The Perita Rebellion), Rotation A can drop Galariak Prime Blueprint.",
    "conditions":  {
                       "rotation":  "A"
                   },
    "values":  {
                   "location":  "Dark Refractory, Deimos/Recall: Hunhullus (The Perita Rebellion), Rotation A",
                   "chance":  5.71,
                   "rarity":  "Rare",
                   "rewardType":  "Galariak Prime Blueprint",
                   "parentId":  "weapon.galariak-prime",
                   "rawLocation":  "Dark Refractory, Deimos/Recall: Hunhullus (The Perita Rebellion), Rotation A",
                   "locationPlanet":  "Dark Refractory, Deimos",
                   "locationNode":  "Recall: Hunhullus",
                   "missionType":  "The Perita Rebellion"
               },
    "tags":  [
                 "drop",
                 "wfcd-generated",
                 "activity-normalized"
             ],
    "sources":  [
                    {
                        "type":  "wfcd-generated",
                        "value":  "drop:weapon.galariak-prime"
                    }
                ]
}
