{
    "id":  "relationship.drop-oberon-prime-chassis-axi-h2-relic-flawless",
    "type":  "wfcd_drop",
    "from":  "source.axi-h2-relic-flawless",
    "to":  "part.oberon-prime-chassis",
    "summary":  "Axi H2 Relic (Flawless) can drop Oberon Prime Chassis Blueprint.",
    "conditions":  {

                   },
    "values":  {
                   "location":  "Axi H2 Relic (Flawless)",
                   "chance":  20,
                   "rarity":  "Uncommon",
                   "rewardType":  "Oberon Prime Chassis Blueprint",
                   "parentId":  "warframe.oberon-prime"
               },
    "tags":  [
                 "drop",
                 "wfcd-generated"
             ],
    "sources":  [
                    {
                        "type":  "wfcd-generated",
                        "value":  "drop:warframe.oberon-prime"
                    }
                ]
}
