{
    "id":  "relationship.drop-rubico-prime-blueprint-meso-r3-relic-radiant",
    "type":  "wfcd_drop",
    "from":  "source.meso-r3-relic-radiant",
    "to":  "part.rubico-prime-blueprint",
    "summary":  "Meso R3 Relic (Radiant) can drop Rubico Prime Blueprint.",
    "conditions":  {

                   },
    "values":  {
                   "location":  "Meso R3 Relic (Radiant)",
                   "chance":  10,
                   "rarity":  "Uncommon",
                   "rewardType":  "Rubico Prime Blueprint",
                   "parentId":  "weapon.rubico-prime"
               },
    "tags":  [
                 "drop",
                 "wfcd-generated"
             ],
    "sources":  [
                    {
                        "type":  "wfcd-generated",
                        "value":  "drop:weapon.rubico-prime"
                    }
                ]
}
