{
    "id":  "relationship.relic-reward-meso-v4-intact-carrier-prime-blueprint",
    "type":  "relic_reward",
    "from":  "relic.meso-v4-intact",
    "to":  "part.carrier-prime-blueprint",
    "summary":  "relic.meso-v4-intact contains Carrier Prime Blueprint as a reward.",
    "conditions":  {
                       "rarity":  "Uncommon"
                   },
    "values":  {
                   "chance":  25.33,
                   "rewardName":  "Carrier Prime Blueprint"
               },
    "tags":  [
                 "relic",
                 "reward",
                 "wfcd-generated"
             ],
    "sources":  [
                    {
                        "type":  "wfcd-generated",
                        "value":  "relic:relic.meso-v4-intact"
                    }
                ]
}
