{
    "id":  "relationship.drop-akbronco-prime-link-lith-a2-relic-flawless",
    "type":  "wfcd_drop",
    "from":  "source.lith-a2-relic-flawless",
    "to":  "part.akbronco-prime-link",
    "summary":  "Lith A2 Relic (Flawless) can drop Akbronco Prime Link.",
    "conditions":  {

                   },
    "values":  {
                   "location":  "Lith A2 Relic (Flawless)",
                   "chance":  17,
                   "rarity":  "Uncommon",
                   "rewardType":  "Akbronco Prime Link",
                   "parentId":  "weapon.akbronco-prime"
               },
    "tags":  [
                 "drop",
                 "wfcd-generated"
             ],
    "sources":  [
                    {
                        "type":  "wfcd-generated",
                        "value":  "drop:weapon.akbronco-prime"
                    }
                ]
}
