{
    "id":  "relationship.relic-reward-axi-s10-exceptional-bronco-prime-barrel",
    "type":  "relic_reward",
    "from":  "relic.axi-s10-exceptional",
    "to":  "part.bronco-prime-barrel",
    "summary":  "relic.axi-s10-exceptional contains Bronco Prime Barrel as a reward.",
    "conditions":  {
                       "rarity":  "Uncommon"
                   },
    "values":  {
                   "chance":  13,
                   "rewardName":  "Bronco Prime Barrel"
               },
    "tags":  [
                 "relic",
                 "reward",
                 "wfcd-generated"
             ],
    "sources":  [
                    {
                        "type":  "wfcd-generated",
                        "value":  "relic:relic.axi-s10-exceptional"
                    }
                ]
}
