{
    "id":  "relationship.drop-mirage-prime-chassis-lith-k5-relic",
    "type":  "wfcd_drop",
    "from":  "relic.lith-k5",
    "to":  "part.mirage-prime-chassis",
    "summary":  "Lith K5 Relic can drop Mirage Prime Chassis Blueprint.",
    "conditions":  {

                   },
    "values":  {
                   "location":  "Lith K5 Relic",
                   "chance":  25.33,
                   "rarity":  "Uncommon",
                   "rewardType":  "Mirage Prime Chassis Blueprint",
                   "parentId":  "warframe.mirage-prime",
                   "rawLocation":  "Lith K5 Relic"
               },
    "tags":  [
                 "drop",
                 "wfcd-generated",
                 "relic-normalized"
             ],
    "sources":  [
                    {
                        "type":  "wfcd-generated",
                        "value":  "drop:warframe.mirage-prime"
                    }
                ]
}
