{
    "id":  "relationship.craft-cernos-prime-cernos-prime",
    "type":  "crafting_dependency",
    "from":  "weapon.cernos-prime",
    "to":  "part.cernos-prime-",
    "summary":  "weapon.cernos-prime requires  as a crafting component.",
    "conditions":  {

                   },
    "values":  {
                   "itemCount":  1,
                   "componentName":  null
               },
    "tags":  [
                 "crafting",
                 "wfcd-generated"
             ],
    "sources":  [
                    {
                        "type":  "wfcd-generated",
                        "value":  "component:weapon.cernos-prime"
                    }
                ]
}
