{
    "id":  "relationship.relic-reward-lith-m10-exceptional-orthos-prime-handle",
    "type":  "relic_reward",
    "from":  "relic.lith-m10-exceptional",
    "to":  "part.orthos-prime-handle",
    "summary":  "relic.lith-m10-exceptional contains Orthos Prime Handle as a reward.",
    "conditions":  {
                       "rarity":  "Uncommon"
                   },
    "values":  {
                   "chance":  23.33,
                   "rewardName":  "Orthos Prime Handle"
               },
    "tags":  [
                 "relic",
                 "reward",
                 "wfcd-generated"
             ],
    "sources":  [
                    {
                        "type":  "wfcd-generated",
                        "value":  "relic:relic.lith-m10-exceptional"
                    }
                ]
}
