{
    "id":  "relationship.relic-reward-axi-o5-intact-octavia-prime-blueprint",
    "type":  "relic_reward",
    "from":  "relic.axi-o5-intact",
    "to":  "part.octavia-prime-blueprint",
    "summary":  "relic.axi-o5-intact contains Octavia Prime Blueprint as a reward.",
    "conditions":  {
                       "rarity":  "Rare"
                   },
    "values":  {
                   "chance":  2,
                   "rewardName":  "Octavia Prime Blueprint"
               },
    "tags":  [
                 "relic",
                 "reward",
                 "wfcd-generated"
             ],
    "sources":  [
                    {
                        "type":  "wfcd-generated",
                        "value":  "relic:relic.axi-o5-intact"
                    }
                ]
}
