{
    "id":  "relationship.relic-reward-neo-s2-exceptional-nova-prime-systems-blueprint",
    "type":  "relic_reward",
    "from":  "relic.neo-s2-exceptional",
    "to":  "part.nova-prime-systems-blueprint",
    "summary":  "relic.neo-s2-exceptional contains Nova Prime Systems Blueprint as a reward.",
    "conditions":  {
                       "rarity":  "Uncommon"
                   },
    "values":  {
                   "chance":  23.33,
                   "rewardName":  "Nova Prime Systems Blueprint"
               },
    "tags":  [
                 "relic",
                 "reward",
                 "wfcd-generated"
             ],
    "sources":  [
                    {
                        "type":  "wfcd-generated",
                        "value":  "relic:relic.neo-s2-exceptional"
                    }
                ]
}
