{
    "id":  "relationship.drop-tenora-prime-barrel-neo-t6-relic",
    "type":  "wfcd_drop",
    "from":  "relic.neo-t6",
    "to":  "part.tenora-prime-barrel",
    "summary":  "Neo T6 Relic can drop Tenora Prime Barrel.",
    "conditions":  {

                   },
    "values":  {
                   "location":  "Neo T6 Relic",
                   "chance":  2,
                   "rarity":  "Rare",
                   "rewardType":  "Tenora Prime Barrel",
                   "parentId":  "weapon.tenora-prime",
                   "rawLocation":  "Neo T6 Relic"
               },
    "tags":  [
                 "drop",
                 "wfcd-generated",
                 "relic-normalized"
             ],
    "sources":  [
                    {
                        "type":  "wfcd-generated",
                        "value":  "drop:weapon.tenora-prime"
                    }
                ]
}
