{
    "id":  "relationship.craft-twin-gremlins-twin-gremlins-blueprint",
    "type":  "crafting_dependency",
    "from":  "weapon.twin-gremlins",
    "to":  "part.twin-gremlins-blueprint",
    "summary":  "weapon.twin-gremlins requires Blueprint as a crafting component.",
    "conditions":  {

                   },
    "values":  {
                   "itemCount":  1,
                   "componentName":  "Blueprint"
               },
    "tags":  [
                 "crafting",
                 "wfcd-generated"
             ],
    "sources":  [
                    {
                        "type":  "wfcd-generated",
                        "value":  "component:weapon.twin-gremlins"
                    }
                ]
}
