{
    "id":  "relationship.relic-reward-lith-c7-flawless-forma-blueprint",
    "type":  "relic_reward",
    "from":  "relic.lith-c7-flawless",
    "to":  "part.forma-blueprint",
    "summary":  "relic.lith-c7-flawless contains Forma Blueprint as a reward.",
    "conditions":  {
                       "rarity":  "Uncommon"
                   },
    "values":  {
                   "chance":  20,
                   "rewardName":  "Forma Blueprint"
               },
    "tags":  [
                 "relic",
                 "reward",
                 "wfcd-generated"
             ],
    "sources":  [
                    {
                        "type":  "wfcd-generated",
                        "value":  "relic:relic.lith-c7-flawless"
                    }
                ]
}
