{
    "id":  "relationship.drop-lato-vandal-receiver-elite-sanctuary-onslaught-rotation-c",
    "type":  "wfcd_drop",
    "from":  "activity.elite-sanctuary-onslaught",
    "to":  "part.lato-vandal-receiver",
    "summary":  "Elite Sanctuary Onslaught, Rotation C can drop Lato Vandal Receiver.",
    "conditions":  {
                       "rotation":  "C"
                   },
    "values":  {
                   "location":  "Elite Sanctuary Onslaught, Rotation C",
                   "chance":  3.16,
                   "rarity":  "Rare",
                   "rewardType":  "Lato Vandal Receiver",
                   "parentId":  "weapon.lato-vandal",
                   "rawLocation":  "Elite Sanctuary Onslaught, Rotation C",
                   "locationPlanet":  "Rotation C",
                   "locationNode":  "Elite Sanctuary Onslaught",
                   "specialActivityLabel":  "Elite Sanctuary Onslaught"
               },
    "tags":  [
                 "drop",
                 "wfcd-generated",
                 "activity-normalized",
                 "special-activity-normalized"
             ],
    "sources":  [
                    {
                        "type":  "wfcd-generated",
                        "value":  "drop:weapon.lato-vandal"
                    }
                ]
}
