{
    "id":  "relationship.relic-reward-meso-b4-exceptional-bronco-prime-receiver",
    "type":  "relic_reward",
    "from":  "relic.meso-b4-exceptional",
    "to":  "part.bronco-prime-receiver",
    "summary":  "relic.meso-b4-exceptional contains Bronco Prime Receiver as a reward.",
    "conditions":  {
                       "rarity":  "Uncommon"
                   },
    "values":  {
                   "chance":  23.33,
                   "rewardName":  "Bronco Prime Receiver"
               },
    "tags":  [
                 "relic",
                 "reward",
                 "wfcd-generated"
             ],
    "sources":  [
                    {
                        "type":  "wfcd-generated",
                        "value":  "relic:relic.meso-b4-exceptional"
                    }
                ]
}
