{
    "id":  "relationship.activity-location-complete-octavia-s-anthem-cephalon-simaris-complete-octavia-s-anthem",
    "type":  "activity_location",
    "from":  "activity.complete-octavia-s-anthem-cephalon-simaris",
    "to":  "location.complete-octavia-s-anthem",
    "summary":  "activity.complete-octavia-s-anthem-cephalon-simaris belongs to location.complete-octavia-s-anthem.",
    "conditions":  {

                   },
    "values":  {

               },
    "tags":  [
                 "activity",
                 "location",
                 "generated"
             ],
    "sources":  [
                    {
                        "type":  "wfcd-location-normalizer",
                        "value":  "activity.complete-octavia-s-anthem-cephalon-simaris"
                    }
                ]
}
