{
    "id":  "relationship.drop-pangolin-prime-handle-neo-n17-relic-flawless",
    "type":  "wfcd_drop",
    "from":  "source.neo-n17-relic-flawless",
    "to":  "part.pangolin-prime-handle",
    "summary":  "Neo N17 Relic (Flawless) can drop Pangolin Prime Handle.",
    "conditions":  {

                   },
    "values":  {
                   "location":  "Neo N17 Relic (Flawless)",
                   "chance":  20,
                   "rarity":  "Uncommon",
                   "rewardType":  "Pangolin Prime Handle",
                   "parentId":  "weapon.pangolin-prime"
               },
    "tags":  [
                 "drop",
                 "wfcd-generated"
             ],
    "sources":  [
                    {
                        "type":  "wfcd-generated",
                        "value":  "drop:weapon.pangolin-prime"
                    }
                ]
}
