{
    "id":  "relationship.drop-wukong-prime-chassis-meso-b4-relic-exceptional",
    "type":  "wfcd_drop",
    "from":  "source.meso-b4-relic-exceptional",
    "to":  "part.wukong-prime-chassis",
    "summary":  "Meso B4 Relic (Exceptional) can drop Wukong Prime Chassis Blueprint.",
    "conditions":  {

                   },
    "values":  {
                   "location":  "Meso B4 Relic (Exceptional)",
                   "chance":  13,
                   "rarity":  "Uncommon",
                   "rewardType":  "Wukong Prime Chassis Blueprint",
                   "parentId":  "warframe.wukong-prime"
               },
    "tags":  [
                 "drop",
                 "wfcd-generated"
             ],
    "sources":  [
                    {
                        "type":  "wfcd-generated",
                        "value":  "drop:warframe.wukong-prime"
                    }
                ]
}
